{
  "schemaVersion": 1,
  "revision": 1,
  "materials": {
    "jack_o_lantern": "Jack o'Lantern"
  },
  "entities": {},
  "worlds": {},
  "gameModes": {},
  "dimensions": {
    "overworld": "Overworld",
    "the_nether": "The Nether",
    "the_end": "The End"
  },
  "damageCauses": {},
  "effects": {},
  "groups": {}
}
